{
  "schema_version": "1.0.0",
  "brief_id": "brief-pf02-stale-rev-001",
  "source_request_id": "req-pf02-stale-rev",
  "project_snapshot": {
    "project_id": "proj_pf02_scenario1",
    "base_revision": 0,
    "snapshot_sha256": "cbfddbf87fdaf3a485c7b02eb8fd05c87c9f7e98f349351d3090d309176006b1",
    "timebase_ticks_per_second": 120000
  },
  "goal": {
    "objective": "Attempt edit on stale revision 0",
    "success_criteria": ["Should be blocked by concurrency check"]
  },
  "requested_changes": [
    {
      "change_id": "CHG-STALE-001",
      "domain": "timeline",
      "description": "Trim clip_1",
      "target_ids": ["clip_1"]
    }
  ],
  "constraints": [],
  "deliverables": [],
  "ambiguities": [],
  "validation": {
    "status": "ready",
    "blocking_issue_ids": []
  }
}
