{
  "schema_version": "1.0.0",
  "brief_id": "brief-pf01-g02-reel",
  "source_request_id": "req-pf01-g02",
  "project_snapshot": {
    "project_id": "proj_g02_reel",
    "base_revision": 2,
    "snapshot_sha256": "4d900d3e4859d0ef8bd78491dd04d55900642ef6c0c95c8867e8bfd54e6b701e",
    "timebase_ticks_per_second": 120000
  },
  "goal": {
    "objective": "Cut 30-second vertical social reel from interview footage",
    "success_criteria": [
      "Timeline duration trimmed to 30 seconds",
      "Vertical 9:16 aspect ratio delivered",
      "Dialogue synchronization and cadence preserved"
    ]
  },
  "requested_changes": [
    {
      "change_id": "CHG-CUT-001",
      "domain": "timeline",
      "description": "Cut 30s vertical reel from interview_01",
      "target_ids": [
        "asset_interview_01",
        "asset_interview_dialogue"
      ]
    }
  ],
  "constraints": [
    {
      "constraint_id": "C-MUSIC-001",
      "type": "forbid_effect",
      "strength": "hard",
      "target": {
        "kind": "project",
        "entity_type": "any",
        "ids": []
      },
      "forbidden_effects": [
        "music_content_added",
        "music_asset_attached",
        "music_generated"
      ],
      "baseline_revision": 2,
      "comparison": "exact",
      "on_violation": "block",
      "on_unknown": "block",
      "verify_at": [
        "plan_preflight",
        "post_execution",
        "pre_render"
      ],
      "origin": {
        "kind": "explicit_user",
        "source_text": "Do not add music"
      }
    },
    {
      "constraint_id": "C-DIALOGUE-TIME-002",
      "type": "preserve_fields",
      "strength": "hard",
      "target": {
        "kind": "role",
        "entity_type": "clip",
        "role": "dialogue",
        "ids": [
          "clip_dialogue_01"
        ]
      },
      "fields": [
        "timeline_interval",
        "source_interval",
        "time_remap",
        "sync_offset"
      ],
      "baseline_revision": 2,
      "comparison": "exact",
      "on_violation": "block",
      "on_unknown": "block",
      "verify_at": [
        "plan_preflight",
        "post_execution",
        "pre_render"
      ],
      "origin": {
        "kind": "explicit_user",
        "source_text": "Preserve dialogue timing"
      }
    }
  ],
  "deliverables": [
    {
      "kind": "video",
      "container": "mp4",
      "video": {
        "codec": "h264",
        "width": 1080,
        "height": 1920,
        "frame_rate": {
          "numerator": 30,
          "denominator": 1
        }
      },
      "audio": {
        "codec": "aac",
        "sample_rate_hz": 48000,
        "channels": 2
      }
    }
  ],
  "ambiguities": [],
  "validation": {
    "status": "ready",
    "blocking_issue_ids": []
  }
}
